{
  "action_id": "action-pilot-retrospective",
  "content_digest": "sha256:6e08a25aa57977360e68b0dd920416a522af05b7fbaf0595e3a543ee3219cd8c",
  "created_at": "2026-07-01T00:00:00Z",
  "edge_id": "edge-claim-to-proposed_action",
  "from_node_id": "node-claim",
  "notes": null,
  "relation": "proposes",
  "schema_version": "v1",
  "to_node_id": "node-proposed_action"
}
