{
  "action_id": "action-pilot-retrospective",
  "content_digest": "sha256:28cf12f418325223ae893a1a32897a6089e18ca8b98224a940a1a570af55eead",
  "created_at": "2026-07-01T00:00:00Z",
  "edge_id": "edge-grant-to-runtime_action",
  "from_node_id": "node-grant",
  "notes": null,
  "relation": "executes",
  "schema_version": "v1",
  "to_node_id": "node-runtime_action"
}
