{
  "action_id": "action-pilot-retrospective",
  "content_digest": "sha256:be38a85cc42176ce51e658e8caceb2c36bf3295f8151055e81ff7581d7d61e05",
  "created_at": "2026-07-01T00:00:00Z",
  "edge_id": "edge-evidence-to-claim",
  "from_node_id": "node-evidence",
  "notes": null,
  "relation": "supports",
  "schema_version": "v1",
  "to_node_id": "node-claim"
}
