{
  "action_id": "action-pilot-shadow",
  "content_digest": "sha256:92cca3d9e2b31ae59ba216dab6cbaeb2a575846ee97b6543d6b0470e66b71085",
  "created_at": "2026-07-01T00:00:00Z",
  "edge_id": "edge-verification_result-to-outcome",
  "from_node_id": "node-verification_result",
  "notes": null,
  "relation": "realizes",
  "schema_version": "v1",
  "to_node_id": "node-outcome-outcome-1"
}
