{
  "action_id": "action-pilot-shadow",
  "content_digest": "sha256:32d572253513caa2aff2fb5e2aec4182ab3aa2037896c87ebf8625bb0f4818d9",
  "created_at": "2026-07-01T00:00:00Z",
  "edge_id": "edge-claim-to-proposed_action",
  "from_node_id": "node-claim",
  "notes": null,
  "relation": "proposes",
  "schema_version": "v1",
  "to_node_id": "node-proposed_action"
}
