{
  "action_id": "action-pilot-retrospective",
  "content_digest": "sha256:debae11ed3924f72d07fb3be2e07e7c8d635969dd069afd8db7a0d711432c1f6",
  "created_at": "2026-07-01T00:00:00Z",
  "edge_id": "edge-verification_result-to-outcome",
  "from_node_id": "node-verification_result",
  "notes": null,
  "relation": "realizes",
  "schema_version": "v1",
  "to_node_id": "node-outcome-outcome-1"
}
