{
  "action_id": "action-valid-release",
  "content_digest": "sha256:b4cc871d335285b9967f770d58e0f5daffc7ce7ac2795c579d730d6a8e8801c6",
  "created_at": "2026-07-01T00:00:00Z",
  "edge_id": "edge-runtime_action-to-verification_result",
  "from_node_id": "node-runtime_action",
  "notes": null,
  "relation": "verifies",
  "schema_version": "v1",
  "to_node_id": "node-verification_result"
}
