{
  "action_id": "action-pilot-shadow",
  "content_digest": "sha256:dd0ef594f45713699307153b088f68c5d13c39edce20ca574456b2e36bedd195",
  "created_at": "2026-07-01T00:00:00Z",
  "edge_id": "edge-source-to-evidence",
  "from_node_id": "node-source",
  "notes": null,
  "relation": "supports",
  "schema_version": "v1",
  "to_node_id": "node-evidence"
}
