{
  "action_id": "action-valid-release",
  "content_digest": "sha256:5804eca3949e5dadca599cd300a197295e549830afd5265b74a2514303590c40",
  "created_at": "2026-07-01T00:00:00Z",
  "edge_id": "edge-proposed_action-to-admissibility_decision",
  "from_node_id": "node-proposed_action",
  "notes": null,
  "relation": "decides",
  "schema_version": "v1",
  "to_node_id": "node-admissibility_decision"
}
