{
  "action_id": "action-pilot-shadow",
  "content_digest": "sha256:39b1fd1696ec107b98b35f0e853190508da22c6a2a000edff90c59e2dcb4052f",
  "created_at": "2026-07-01T00:00:00Z",
  "edge_id": "edge-evidence-to-claim",
  "from_node_id": "node-evidence",
  "notes": null,
  "relation": "supports",
  "schema_version": "v1",
  "to_node_id": "node-claim"
}
