{
  "action_id": "action-pilot-retrospective",
  "content_digest": "sha256:14cb16d970f885ee7e1fb8e9914b0226d85c251ee1e17bb825981e25574cbba0",
  "created_at": "2026-07-01T00:00:00Z",
  "edge_id": "edge-admissibility_decision-to-review",
  "from_node_id": "node-admissibility_decision",
  "notes": null,
  "relation": "reviews",
  "schema_version": "v1",
  "to_node_id": "node-review"
}
