{
  "action_id": "action-valid-release",
  "content_digest": "sha256:6f9ab7496402aa1bd1eff81703179c8d9882b75383edf222e93c6f83a7406c88",
  "created_at": "2026-07-01T00:00:00Z",
  "edge_id": "edge-claim-to-proposed_action",
  "from_node_id": "node-claim",
  "notes": null,
  "relation": "proposes",
  "schema_version": "v1",
  "to_node_id": "node-proposed_action"
}
