{
  "action_id": "action-pilot-retrospective",
  "content_digest": "sha256:3c8d4d2630bca46a445fdb1508f65b76afcfb514a95ffaa3f059112f2c4cec52",
  "created_at": "2026-07-01T00:00:00Z",
  "edge_id": "edge-review-to-grant",
  "from_node_id": "node-review",
  "notes": null,
  "relation": "grants",
  "schema_version": "v1",
  "to_node_id": "node-grant"
}
