{
  "action_id": "action-pilot-shadow",
  "content_digest": "sha256:88a75be1abb2158bcf772569ba7c8ec8f00b3eafba67474eff8dd00ad63737e3",
  "created_at": "2026-07-01T00:00:00Z",
  "edge_id": "edge-proposed_action-to-admissibility_decision",
  "from_node_id": "node-proposed_action",
  "notes": null,
  "relation": "decides",
  "schema_version": "v1",
  "to_node_id": "node-admissibility_decision"
}
