{
  "action_id": "action-valid-release",
  "content_digest": "sha256:72c477b9bd33d83c1cc65f9cfcde65c43f4bf62acd0473c33d174c0691840d49",
  "created_at": "2026-07-01T00:00:00Z",
  "edge_id": "edge-source-to-evidence",
  "from_node_id": "node-source",
  "notes": null,
  "relation": "supports",
  "schema_version": "v1",
  "to_node_id": "node-evidence"
}
